{
  "$schema": "https://loft.dev/schema/facet-1.json",
  "kind": "motion",
  "id": "default",
  "name": "Loft",
  "description": "Product default: every key a facet leaves out takes this value (fill)",
  "data": {
    "speed": 1.0,
    "shell": {
      "durations": {
        "instant": 90,
        "fast": 160,
        "normal": 260,
        "slow": 420
      },
      "curves": {
        "standard": [
          0.2,
          0.0,
          0.0,
          1.0
        ],
        "emphasized": [
          0.05,
          0.7,
          0.1,
          1.0
        ],
        "exit": [
          0.3,
          0.0,
          0.8,
          0.15
        ]
      },
      "spring": {
        "damping": 0.82,
        "stiffness": 380
      }
    },
    "niri": {},
    "minimal": false
  }
}
