{
  "$schema": "https://loft.dev/schema/facet-1.json",
  "kind": "material",
  "id": "default",
  "name": "Liquid Glass",
  "description": "Product default: every key a facet leaves out takes this value (fill)",
  "data": {
    "blur": {
      "enabled": true,
      "xray": true,
      "noise": 0.02,
      "saturation": 1.6
    },
    "glass": {
      "opacity": {
        "dark": 0.45,
        "light": 0.5
      },
      "tint": "@bg",
      "border": "#ffffff",
      "borderOpacity": {
        "dark": 0.14,
        "light": 0.6
      },
      "edgeDarken": {
        "dark": 0.35,
        "light": 0.18
      },
      "specular": {
        "dark": 0.5,
        "light": 0.75
      }
    },
    "terminals": {
      "opacity": null,
      "blur": true
    },
    "windows": {
      "translucent": true,
      "opacity": {
        "focused": 0.9,
        "unfocused": 0.8
      },
      "blur": true
    },
    "menuBar": {
      "background": false,
      "adaptiveText": true
    }
  }
}
