{
  "$schema": "https://loft.dev/schema/facet-1.json",
  "kind": "launcher",
  "id": "default",
  "name": "Spotlight",
  "description": "Product default: every key a facet leaves out takes this value (fill)",
  "data": {
    "style": "spotlight",
    "css": null,
    "layout": null,
    "width": 680,
    "glass": 1.6
  }
}
